{
  "$schema": "../.gamekit/schemas/motion.schema.json",
  "name": "hop",
  "role": "action",
  "brief": "Nhảy tại chỗ (pivot ở chân). Chuẩn bị: nén 0.72 trong 9 khung, cúi đầu, vung tay ra sau, giữ 3 khung. Action: bật lên 10 khung (out), giãn 1.25 lúc rời đất, tay vung lên trước, chân thu lại; tròn ở đỉnh (out rồi in = treo ở đỉnh). Rơi 12 khung (in), tay và tai bị kéo lên (drag). Chạm đất: bẹp 0.68 trong 2 khung, gật đầu, tai và đuôi quất xuống rồi dao động tắt dần, mắt nheo. Mọi phần về pose nghỉ ở cuối.",
  "tracks": {
    "body.bulge": [
      { "f": 0, "v": 0 },
      { "f": 9, "v": 0.14, "ease": "inOut" },
      { "f": 12, "v": 0.14 },
      { "f": 15, "v": -0.06, "ease": "out" },
      { "f": 22, "v": 0, "ease": "inOut" },
      { "f": 34, "v": 0 },
      { "f": 36, "v": 0.2, "ease": "out" },
      { "f": 44, "v": -0.04, "ease": "out" },
      { "f": 52, "v": 0, "ease": "inOut" }
    ],
    "body.bend": [
      { "f": 0, "v": 0 },
      { "f": 9, "v": 6, "ease": "inOut" },
      { "f": 12, "v": 6 },
      { "f": 16, "v": -8, "ease": "out" },
      { "f": 26, "v": 0, "ease": "inOut" },
      { "f": 34, "v": 0 },
      { "f": 37, "v": 7, "ease": "out" },
      { "f": 46, "v": -2, "ease": "inOut" },
      { "f": 54, "v": 0, "ease": "inOut" }
    ],
    "legL.bend": [
      { "f": 0, "v": 0 },
      { "f": 12, "v": 0 },
      { "f": 18, "v": 25, "ease": "out" },
      { "f": 30, "v": 10, "ease": "inOut" },
      { "f": 35, "v": 0, "ease": "out" }
    ],
    "legR.bend": [
      { "f": 0, "v": 0 },
      { "f": 12, "v": 0 },
      { "f": 18, "v": 30, "ease": "out" },
      { "f": 30, "v": 12, "ease": "inOut" },
      { "f": 35, "v": 0, "ease": "out" }
    ],
    "body.y": [
      { "f": 0, "v": 0 },
      { "f": 12, "v": 0 },
      { "f": 22, "v": -110, "ease": "out", "beat": "action" },
      { "f": 34, "v": 0, "ease": "in" }
    ],
    "body.stretch": [
      { "f": 0, "v": 1 },
      { "f": 9, "v": 0.72, "ease": "inOut", "beat": "anticipation" },
      { "f": 12, "v": 0.72 },
      { "f": 15, "v": 1.25, "ease": "out" },
      { "f": 22, "v": 1, "ease": "inOut" },
      { "f": 34, "v": 1.18, "ease": "in" },
      { "f": 36, "v": 0.68, "ease": "out" },
      { "f": 44, "v": 1.08, "ease": "out", "beat": "overshoot" },
      { "f": 52, "v": 0.98, "ease": "inOut" },
      { "f": 58, "v": 1, "ease": "inOut", "beat": "settle" }
    ],
    "head.rot": [
      { "f": 0, "v": 0 },
      { "f": 9, "v": 8, "ease": "inOut" },
      { "f": 12, "v": 8 },
      { "f": 16, "v": -10, "ease": "out" },
      { "f": 26, "v": -4, "ease": "inOut" },
      { "f": 34, "v": -6, "ease": "inOut" },
      { "f": 38, "v": 10, "ease": "out" },
      { "f": 46, "v": -3, "ease": "inOut" },
      { "f": 54, "v": 0, "ease": "inOut" }
    ],
    "armL.rot": [
      { "f": 0, "v": 0 },
      { "f": 9, "v": 35, "ease": "inOut" },
      { "f": 12, "v": 35 },
      { "f": 16, "v": -70, "ease": "out" },
      { "f": 24, "v": -30, "ease": "inOut" },
      { "f": 34, "v": -60, "ease": "inOut" },
      { "f": 38, "v": 15, "ease": "out" },
      { "f": 46, "v": -5, "ease": "inOut" },
      { "f": 54, "v": 0, "ease": "inOut" }
    ],
    "armR.rot": [
      { "f": 0, "v": 0 },
      { "f": 10, "v": 40, "ease": "inOut" },
      { "f": 12, "v": 40 },
      { "f": 17, "v": -80, "ease": "out" },
      { "f": 25, "v": -35, "ease": "inOut" },
      { "f": 34, "v": -65, "ease": "inOut" },
      { "f": 39, "v": 15, "ease": "out" },
      { "f": 47, "v": -5, "ease": "inOut" },
      { "f": 55, "v": 0, "ease": "inOut" }
    ],
    "legL.rot": [
      { "f": 0, "v": 0 },
      { "f": 12, "v": 0 },
      { "f": 16, "v": 15, "ease": "out" },
      { "f": 24, "v": -20, "ease": "inOut" },
      { "f": 32, "v": -10, "ease": "inOut" },
      { "f": 35, "v": 0, "ease": "out" }
    ],
    "legR.rot": [
      { "f": 0, "v": 0 },
      { "f": 12, "v": 0 },
      { "f": 16, "v": 10, "ease": "out" },
      { "f": 24, "v": -25, "ease": "inOut" },
      { "f": 32, "v": -12, "ease": "inOut" },
      { "f": 35, "v": 0, "ease": "out" }
    ],
    "earR.rot": [
      { "f": 0, "v": 0 },
      { "f": 14, "v": 0 },
      { "f": 19, "v": 30, "ease": "out" },
      { "f": 30, "v": -10, "ease": "inOut" },
      { "f": 37, "v": 25, "ease": "out" },
      { "f": 43, "v": -8, "ease": "inOut" },
      { "f": 50, "v": 3, "ease": "inOut" },
      { "f": 56, "v": 0, "ease": "inOut" }
    ],
    "earL.rot": [
      { "f": 0, "v": 0 },
      { "f": 15, "v": 0 },
      { "f": 20, "v": -25, "ease": "out" },
      { "f": 31, "v": 8, "ease": "inOut" },
      { "f": 38, "v": -22, "ease": "out" },
      { "f": 44, "v": 6, "ease": "inOut" },
      { "f": 51, "v": -2, "ease": "inOut" },
      { "f": 57, "v": 0, "ease": "inOut" }
    ],
    "tail.rot": [
      { "f": 0, "v": 0 },
      { "f": 14, "v": 0 },
      { "f": 20, "v": -25, "ease": "out" },
      { "f": 34, "v": -10, "ease": "inOut" },
      { "f": 38, "v": 25, "ease": "out" },
      { "f": 44, "v": -10, "ease": "inOut" },
      { "f": 50, "v": 5, "ease": "inOut" },
      { "f": 56, "v": 0, "ease": "inOut" }
    ],
    "eyes.sy": [
      { "f": 0, "v": 1 },
      { "f": 34, "v": 1 },
      { "f": 36, "v": 0.4, "ease": "out" },
      { "f": 42, "v": 1, "ease": "out" }
    ],
    "mouth.sy": [
      { "f": 0, "v": 1 },
      { "f": 12, "v": 1 },
      { "f": 16, "v": 2.2, "ease": "out" },
      { "f": 26, "v": 1, "ease": "inOut" }
    ]
  }
}
