{
  "$schema": "../.gamekit/schemas/motion.schema.json",
  "name": "celebrate",
  "role": "action",
  "brief": "Mừng thắng: nén 8 khung, hai tay khép vào; bật 10 khung, dang hai tay hình chữ V (tay trước trễ 2 khung), mắt cười híp, há miệng. Rơi, chạm đất bẹp 0.75, tay nảy theo rồi hạ xuống. Đuôi vẫy liên tục, tai quất mỗi lần đổi hướng.",
  "tracks": {
    "body.bend": [
      { "f": 0, "v": 0 },
      { "f": 8, "v": 6, "ease": "inOut" },
      { "f": 14, "v": -8, "ease": "out" },
      { "f": 30, "v": 0, "ease": "inOut" },
      { "f": 34, "v": 4, "ease": "out" },
      { "f": 44, "v": 0, "ease": "inOut" }
    ],
    "body.bulge": [
      { "f": 0, "v": 0 },
      { "f": 8, "v": 0.12, "ease": "inOut" },
      { "f": 10, "v": 0.12 },
      { "f": 13, "v": -0.05, "ease": "out" },
      { "f": 20, "v": 0, "ease": "inOut" },
      { "f": 30, "v": 0 },
      { "f": 32, "v": 0.16, "ease": "out" },
      { "f": 42, "v": 0, "ease": "inOut" }
    ],
    "armL.bend": [
      { "f": 0, "v": 0 },
      { "f": 15, "v": -20, "ease": "out" },
      { "f": 30, "v": 10, "ease": "inOut" },
      { "f": 46, "v": -10, "ease": "inOut" },
      { "f": 60, "v": 0, "ease": "inOut" }
    ],
    "armR.bend": [
      { "f": 0, "v": 0 },
      { "f": 17, "v": 20, "ease": "out" },
      { "f": 31, "v": -10, "ease": "inOut" },
      { "f": 48, "v": 8, "ease": "inOut" },
      { "f": 62, "v": 0, "ease": "inOut" }
    ],
    "body.y": [
      { "f": 0, "v": 0 },
      { "f": 10, "v": 0 },
      { "f": 20, "v": -70, "ease": "out", "beat": "action" },
      { "f": 30, "v": 0, "ease": "in" }
    ],
    "body.stretch": [
      { "f": 0, "v": 1 },
      { "f": 8, "v": 0.78, "ease": "inOut", "beat": "anticipation" },
      { "f": 10, "v": 0.78 },
      { "f": 13, "v": 1.2, "ease": "out" },
      { "f": 20, "v": 1, "ease": "inOut" },
      { "f": 30, "v": 1.12, "ease": "in" },
      { "f": 32, "v": 0.75, "ease": "out" },
      { "f": 40, "v": 1.06, "ease": "out" },
      { "f": 48, "v": 1, "ease": "inOut" }
    ],
    "armL.rot": [
      { "f": 0, "v": 0 },
      { "f": 8, "v": -25, "ease": "inOut" },
      { "f": 10, "v": -25 },
      { "f": 15, "v": 115, "ease": "out" },
      { "f": 30, "v": 100, "ease": "inOut" },
      { "f": 34, "v": 125, "ease": "out" },
      { "f": 46, "v": 95, "ease": "inOut" },
      { "f": 60, "v": 0, "ease": "inOut" }
    ],
    "armR.rot": [
      { "f": 0, "v": 0 },
      { "f": 9, "v": 30, "ease": "inOut" },
      { "f": 11, "v": 30 },
      { "f": 17, "v": -115, "ease": "out" },
      { "f": 31, "v": -100, "ease": "inOut" },
      { "f": 35, "v": -125, "ease": "out" },
      { "f": 48, "v": -95, "ease": "inOut" },
      { "f": 62, "v": 0, "ease": "inOut" }
    ],
    "head.rot": [
      { "f": 0, "v": 0 },
      { "f": 8, "v": 6, "ease": "inOut" },
      { "f": 14, "v": -12, "ease": "out" },
      { "f": 30, "v": -6, "ease": "inOut" },
      { "f": 34, "v": 6, "ease": "out" },
      { "f": 44, "v": -4, "ease": "inOut" },
      { "f": 54, "v": 0, "ease": "inOut" }
    ],
    "eyes.sy": [
      { "f": 0, "v": 1 },
      { "f": 12, "v": 0.35, "ease": "out" },
      { "f": 50, "v": 0.35 },
      { "f": 58, "v": 1, "ease": "inOut" }
    ],
    "mouth.sy": [
      { "f": 0, "v": 1 },
      { "f": 12, "v": 2.3, "ease": "out" },
      { "f": 50, "v": 2.3 },
      { "f": 58, "v": 1, "ease": "inOut" }
    ],
    "earR.rot": [
      { "f": 0, "v": 0 },
      { "f": 16, "v": 28, "ease": "out" },
      { "f": 28, "v": -10, "ease": "inOut" },
      { "f": 34, "v": 22, "ease": "out" },
      { "f": 42, "v": -6, "ease": "inOut" },
      { "f": 50, "v": 0, "ease": "inOut" }
    ],
    "earL.rot": [
      { "f": 0, "v": 0 },
      { "f": 17, "v": -24, "ease": "out" },
      { "f": 29, "v": 8, "ease": "inOut" },
      { "f": 35, "v": -20, "ease": "out" },
      { "f": 43, "v": 5, "ease": "inOut" },
      { "f": 51, "v": 0, "ease": "inOut" }
    ],
    "tail.rot": [
      { "f": 0, "v": 0 },
      { "f": 12, "v": 20, "ease": "out" },
      { "f": 22, "v": -20, "ease": "inOut" },
      { "f": 32, "v": 20, "ease": "inOut" },
      { "f": 42, "v": -12, "ease": "inOut" },
      { "f": 52, "v": 6, "ease": "inOut" },
      { "f": 60, "v": 0, "ease": "inOut" }
    ]
  }
}
