{
  "$schema": "../.gamekit/schemas/motion.schema.json",
  "name": "hit",
  "role": "reaction",
  "brief": "Bị đánh từ bên phải: ngay khung 1–2 văng về sau, ngả người, bị ép ngang (stretch 1.2), mắt nhắm sập và há miệng (hold) — không chuẩn bị. Đầu, tay, tai, đuôi bị quăng về trước (drag) rồi dao động tắt dần. Trôi thêm 6 khung, hồi 18 khung vượt chỗ cũ một chút rồi settle. Renderer thêm nháy trắng 2–3 khung.",
  "tracks": {
    "body.bend": [
      { "f": 0, "v": 0 },
      { "f": 2, "v": -14, "ease": "out" },
      { "f": 8, "v": -10, "ease": "out" },
      { "f": 18, "v": 6, "ease": "inOut" },
      { "f": 28, "v": 0, "ease": "inOut" }
    ],
    "body.bulge": [
      { "f": 0, "v": 0 },
      { "f": 2, "v": 0.1, "ease": "out" },
      { "f": 10, "v": 0, "ease": "inOut" }
    ],
    "body.x": [
      { "f": 0, "v": 0 },
      { "f": 2, "v": -26, "ease": "out", "beat": "action" },
      { "f": 8, "v": -32, "ease": "out" },
      { "f": 26, "v": 3, "ease": "inOut", "beat": "overshoot" },
      { "f": 34, "v": 0, "ease": "inOut", "beat": "settle" }
    ],
    "body.rot": [
      { "f": 0, "v": 0 },
      { "f": 2, "v": -14, "ease": "out" },
      { "f": 8, "v": -16, "ease": "out" },
      { "f": 24, "v": 3, "ease": "inOut" },
      { "f": 32, "v": 0, "ease": "inOut" }
    ],
    "body.stretch": [
      { "f": 0, "v": 1 },
      { "f": 2, "v": 1.2, "ease": "out" },
      { "f": 6, "v": 0.92, "ease": "out" },
      { "f": 14, "v": 1.03, "ease": "inOut" },
      { "f": 20, "v": 1, "ease": "inOut" }
    ],
    "head.rot": [
      { "f": 0, "v": 0 },
      { "f": 3, "v": -18, "ease": "out" },
      { "f": 10, "v": -20, "ease": "out" },
      { "f": 24, "v": 4, "ease": "inOut" },
      { "f": 32, "v": 0, "ease": "inOut" }
    ],
    "armL.rot": [
      { "f": 0, "v": 0 },
      { "f": 3, "v": -60, "ease": "out" },
      { "f": 12, "v": -30, "ease": "inOut" },
      { "f": 22, "v": 8, "ease": "inOut" },
      { "f": 30, "v": 0, "ease": "inOut" }
    ],
    "armR.rot": [
      { "f": 0, "v": 0 },
      { "f": 4, "v": -75, "ease": "out" },
      { "f": 13, "v": -35, "ease": "inOut" },
      { "f": 23, "v": 8, "ease": "inOut" },
      { "f": 31, "v": 0, "ease": "inOut" }
    ],
    "earR.rot": [
      { "f": 0, "v": 0 },
      { "f": 3, "v": 35, "ease": "out" },
      { "f": 12, "v": -12, "ease": "inOut" },
      { "f": 20, "v": 6, "ease": "inOut" },
      { "f": 28, "v": 0, "ease": "inOut" }
    ],
    "earL.rot": [
      { "f": 0, "v": 0 },
      { "f": 4, "v": 30, "ease": "out" },
      { "f": 13, "v": -10, "ease": "inOut" },
      { "f": 21, "v": 5, "ease": "inOut" },
      { "f": 29, "v": 0, "ease": "inOut" }
    ],
    "tail.rot": [
      { "f": 0, "v": 0 },
      { "f": 4, "v": 22, "ease": "out" },
      { "f": 12, "v": -10, "ease": "inOut" },
      { "f": 20, "v": 5, "ease": "inOut" },
      { "f": 28, "v": 0, "ease": "inOut" }
    ],
    "eyes.sy": [
      { "f": 0, "v": 1 },
      { "f": 1, "v": 0.15, "ease": "hold" },
      { "f": 14, "v": 0.15 },
      { "f": 20, "v": 1, "ease": "out" }
    ],
    "mouth.sy": [
      { "f": 0, "v": 1 },
      { "f": 1, "v": 2.4, "ease": "hold" },
      { "f": 14, "v": 2.4 },
      { "f": 20, "v": 1, "ease": "out" }
    ]
  }
}
