{
  "$schema": "../.gamekit/schemas/motion.schema.json",
  "name": "walk",
  "role": "action",
  "loop": true,
  "brief": "Đi tại chỗ, 20 khung/bước (Williams: contact → down → passing → up). Hông thấp nhất ngay sau contact (f4, f24), cao nhất sau passing. Tay ngược chân cùng bên, trễ 2 khung. Đầu gật trễ thân; tai nảy theo nhịp, tai sau trễ 1 khung; đuôi vẫy mỗi bước.",
  "tracks": {
    "body.y": [
      { "f": 0, "v": 2 },
      { "f": 4, "v": 3 },
      { "f": 15, "v": -2 },
      { "f": 20, "v": 2 },
      { "f": 24, "v": 3 },
      { "f": 35, "v": -2 },
      { "f": 40, "v": 2 }
    ],
    "body.stretch": [
      { "f": 0, "v": 1 },
      { "f": 4, "v": 0.97 },
      { "f": 15, "v": 1.02 },
      { "f": 20, "v": 1 },
      { "f": 24, "v": 0.97 },
      { "f": 35, "v": 1.02 },
      { "f": 40, "v": 1 }
    ],
    "legL.rot": [
      { "f": 0, "v": 25 },
      { "f": 20, "v": -25 },
      { "f": 40, "v": 25 }
    ],
    "legR.rot": [
      { "f": 0, "v": -25 },
      { "f": 20, "v": 25 },
      { "f": 40, "v": -25 }
    ],
    "armL.rot": [
      { "f": 0, "v": -17 },
      { "f": 2, "v": -18 },
      { "f": 22, "v": 18 },
      { "f": 40, "v": -17 }
    ],
    "armR.rot": [
      { "f": 0, "v": 17 },
      { "f": 2, "v": 18 },
      { "f": 22, "v": -18 },
      { "f": 40, "v": 17 }
    ],
    "head.rot": [
      { "f": 0, "v": 0 },
      { "f": 6, "v": 2 },
      { "f": 17, "v": -1 },
      { "f": 26, "v": 2 },
      { "f": 37, "v": -1 },
      { "f": 40, "v": 0 }
    ],
    "earR.rot": [
      { "f": 0, "v": 0 },
      { "f": 6, "v": 6 },
      { "f": 17, "v": -3 },
      { "f": 26, "v": 6 },
      { "f": 37, "v": -3 },
      { "f": 40, "v": 0 }
    ],
    "earL.rot": [
      { "f": 0, "v": 0 },
      { "f": 7, "v": -5 },
      { "f": 18, "v": 3 },
      { "f": 27, "v": -5 },
      { "f": 38, "v": 3 },
      { "f": 40, "v": 0 }
    ],
    "tail.rot": [
      { "f": 0, "v": 6 },
      { "f": 12, "v": -6 },
      { "f": 20, "v": 6 },
      { "f": 32, "v": -6 },
      { "f": 40, "v": 6 }
    ]
  }
}
